id,utterance,label,label_num,file_id,start,end,session,original_emotion,utterance_num
Ses04F_script01_1_F003,What was he doing out here at four in the morning?,xxx,-1,Ses04F_script01,28.1619,31.65,Session4,xxx,6
Ses04F_script01_1_M003,"I don't know.  When it cracked, he ran back into the house and cried in the kitchen.",xxx,-1,Ses04F_script01,31.18,36.6,Session4,xxx,7
Ses04F_script01_1_F004,Did you talk to him?,sad,2,Ses04F_script01,37.1,39.46,Session4,sad,8
Ses04F_script01_1_M004,"No, I figured the best thing was to leave him alone.",sad,2,Ses04F_script01,38.89,43.43,Session4,sad,9
Ses04F_script01_1_F005,He cried hard?,xxx,-1,Ses04F_script01,43.83,46.26,Session4,xxx,10
Ses04F_script01_1_M005,I could hear him right through the floor of my room.,sad,2,Ses04F_script01,46.46,49.9924,Session4,sad,11
Ses04F_script01_1_F006,What was he doing out here at that hour?  He's dreaming about him again.  He's walking around at night.,fru,-1,Ses04F_script01,49.58,58.4511,Session4,fru,12
Ses04F_script01_1_M006,I guess he is.,xxx,-1,Ses04F_script01,58.06,60.11,Session4,xxx,13
Ses04F_script01_1_F007,He's getting just like after he died.,xxx,-1,Ses04F_script01,60.27,63.5161,Session4,xxx,14
Ses04F_script01_1_F008,What's the meaning in that?,xxx,-1,Ses04F_script01,63.8201,65.78,Session4,xxx,15
Ses04F_script01_1_M007,"I don't know the meaning of this, mom.  But I know one thing you made a terrible mistake with dad.",fru,-1,Ses04F_script01,65.04,71.8735,Session4,fru,16
Ses04F_script01_1_F009,What?,sur,-1,Ses04F_script01,71.5696,73.3931,Session4,sur,17
Ses04F_script01_1_M008,"Being dishonest with him, that kind of thing always pays off and now it's paying off.",fru,-1,Ses04F_script01,72.8866,77.7997,Session4,fru,18
Ses04F_script01_1_F010,What do you mean dishonest?,xxx,-1,Ses04F_script01,77.32,79.6738,Session4,xxx,19
Ses04F_script01_1_M009,You know that Larry's not coming back and I know it.  Why do we allow him to go on thinking that we believe with him?,angry,0,Ses04F_script01,79.17,85.64,Session4,ang,20
Ses04F_script01_1_F011,"What do you want to do, argue with him?",angry,0,Ses04F_script01,85.28,87.62,Session4,ang,21
Ses04F_script01_1_M010,I don't want to argue with him but it's time that he realizes that Larry's not coming back anymore.,angry,0,Ses04F_script01,87.22,92.54,Session4,ang,22
Ses04F_script01_1_M011,"Why shouldn't he dream of him?  Walk the nights waiting for him?  Do we contradict him?  Do we say straight out that we have no hope anymore, that we haven't had any hope for years now?",xxx,-1,Ses04F_script01,93.26,103.95,Session4,xxx,23
Ses04F_script01_1_F012,You can't say that to him.,angry,0,Ses04F_script01,103.24,105.01,Session4,ang,24
Ses04F_script01_1_M012,We've got to say it to him.,angry,0,Ses04F_script01,104.31,106.2,Session4,ang,25
Ses04F_script01_1_F013,How are you going to prove it?  Can you prove it?,angry,0,Ses04F_script01,105.64,108.7,Session4,ang,26
Ses04F_script01_1_M013,For God's sake three years.  Nobody comes back after three years.  It's insane.,angry,0,Ses04F_script01,108.09,113.48,Session4,ang,27
Ses04F_script01_1_F014,To you it is and to me but not to him.  You can talk yourself blue in the face but there's no body and no grave so where are you?,angry,0,Ses04F_script01,112.69,120.94,Session4,ang,28
Ses04F_script01_1_M014,Sit down mom.  I want to talk to you.,fru,-1,Ses04F_script01,120.24,122.81,Session4,fru,29
Ses04F_script01_1_F015,The trouble is the goddamn newspapers.  Every month some boy turns up from nowhere so the next one is going to be Larry.,angry,0,Ses04F_script01,122.19,128.67,Session4,ang,30
Ses04F_script01_1_M015,"Alright, alright, alright.  Listen. You know why I asked Annie here don't you?",fru,-1,Ses04F_script01,127.56,133.83,Session4,fru,31
Ses04F_script01_1_F016,Why?,xxx,-1,Ses04F_script01,133.35,135.13,Session4,xxx,32
Ses04F_script01_1_M016,You know why.,neutral,3,Ses04F_script01,134.85,136.9599,Session4,neu,33
Ses04F_script01_1_F017,Well I got an idea but what's the story?,xxx,-1,Ses04F_script01,136.64,141.873,Session4,xxx,34
Ses04F_script01_1_M017,I'm going to ask her to marry me.,neutral,3,Ses04F_script01,141.3158,144.5575,Session4,neu,35
Ses04F_script01_1_F018,"Well that's only your business, Chris.",neutral,3,Ses04F_script01,144.1523,146.85,Session4,neu,36
Ses04F_script01_1_M018,You know it's not only my business.,fru,-1,Ses04F_script01,146.26,148.93,Session4,fru,37
Ses04F_script01_1_F019,What do you want me to do?  You're old enough to know your own mind.,angry,0,Ses04F_script01,148.37,152.02,Session4,ang,38
Ses04F_script01_1_M019,Then it's alright.  I'll go ahead with it.,fru,-1,Ses04F_script01,151.33,154.0798,Session4,fru,39
Ses04F_script01_1_F020,Well you want to make sure that father isn't going to-,xxx,-1,Ses04F_script01,153.5733,156.62,Session4,xxx,40
Ses04F_script01_1_M020,Then it isn't just my business.,angry,0,Ses04F_script01,155.29,158.4,Session4,ang,41
Ses04F_script01_1_F021,I'm just saying.,fru,-1,Ses04F_script01,157.9293,160.36,Session4,fru,42
Ses04F_script01_1_M021,Sometimes you infuriate me.  You know that?  Isn't it your business too if I tell this to father and he throws a fit about it.,angry,0,Ses04F_script01,160.08,166.388,Session4,ang,43
Ses04F_script01_1_M022,Sometimes you have a- Sometimes you have a talent for ignoring things.,angry,0,Ses04F_script01,166.43,170.47,Session4,ang,44
Ses04F_script01_1_F022,I ignore what I got to ignore. The girl is Larry's girl.,angry,0,Ses04F_script01,170.02,174.4921,Session4,ang,45
Ses04F_script01_1_M023,She's not Larry's girl.,fru,-1,Ses04F_script01,174.0363,176.6195,Session4,fru,46
Ses04F_script01_1_F023,"From father's point of view, he's not dead and you have no right to take his girl.",angry,0,Ses04F_script01,176.05,181.5832,Session4,ang,47
Ses04F_script01_1_F024,"Now you can go on from there and you know where to go, but I'm telling you I don't know where to go.  See I don't know.  Now what can I do for you?",angry,0,Ses04F_script01,181.6339,190.35,Session4,ang,48
Ses04F_script01_1_M024,"I don't know why it is but every time I reach out for something I want, I have to pull back because other people will suffer. My whole bloody life time after time after time.",fru,-1,Ses04F_script01,190.29,201.51,Session4,fru,49
Ses04F_script01_1_F025,You're a considerate fellow.  There's nothing wrong in that.,neutral,3,Ses04F_script01,200.73,204.26,Session4,neu,50
Ses04F_script01_1_M025,To hell with that.,angry,0,Ses04F_script01,203.2,205.693,Session4,ang,51
Ses04F_script01_1_F026,Did you ask Annie yet?,xxx,-1,Ses04F_script01,205.15,207.871,Session4,xxx,52
Ses04F_script01_1_M026,I wanted to get this settled first.,sad,2,Ses04F_script01,207.42,210.3529,Session4,sad,53
Ses04F_script01_1_F027,How do you know she'll marry you?  Maybe she feels the same way father does.,fru,-1,Ses04F_script01,209.76,214.54,Session4,fru,54
Ses04F_script01_1_M027,"Well if she does, then that's the end of it.  From her letters, I think she's forgotten him.  I'll find out.",fru,-1,Ses04F_script01,214.18,220.13,Session4,fru,55
Ses04F_script01_1_M028,"and then we'll thrash it out with dad, right mom.  Don't avoid me.",angry,0,Ses04F_script01,220.1792,224.57,Session4,ang,56
Ses04F_script01_1_F028,The trouble is you don't see enough women.  You never did.,fru,-1,Ses04F_script01,224.36,227.35,Session4,fru,57
Ses04F_script01_1_M029,So what I'm not fast with women.,angry,0,Ses04F_script01,226.66,228.92,Session4,ang,58
Ses04F_script01_1_F029,I don't see why it has to be Annie.,angry,0,Ses04F_script01,228.13,230.8,Session4,ang,59
Ses04F_script01_1_M030,Because it is.,angry,0,Ses04F_script01,230.3,232.02,Session4,ang,60
Ses04F_script01_1_F030,Well that's a good answer but it don't answer anything.  You haven't seen her since you went to war.  It's been five years.,angry,0,Ses04F_script01,231.6,239.8824,Session4,ang,61
Ses04F_script01_1_M031,I can't help it.  I know her best.  I was brought up next door to her.,xxx,-1,Ses04F_script01,239.7304,247.12,Session4,xxx,62
Ses04F_script01_1_M032,"These years when I think of someone for my wife, I think of Annie.  What do you want, a diagram?",sad,2,Ses04F_script01,247.3787,254.64,Session4,sad,63
Ses04F_script01_1_F031,"I don't want a diagram.  He thinks he's coming back, Chris.",fru,-1,Ses04F_script01,254.02,260.91,Session4,fru,64
Ses04F_script01_1_F032,You marry that girl.  You're pronouncing him dead.  Now what happens to your father?  Do you know because I don't?,angry,0,Ses04F_script01,261.0038,268.95,Session4,ang,65
Ses04F_script01_1_M033,Alright then mom.,xxx,-1,Ses04F_script01,268.56,270.8807,Session4,xxx,66
Ses04F_script01_1_F033,Just give it some more thought.,xxx,-1,Ses04F_script01,270.3742,272.8,Session4,xxx,67
Ses04F_script01_1_M034,"I've given it three years of thought.  I hoped that if I waited, dad would forget about Larry",angry,0,Ses04F_script01,271.93,278.0668,Session4,ang,68
Ses04F_script01_1_M035,"and everything would be happy and we would have a regular wedding.  But if that can't happen here, then I'll have to get out.",fru,-1,Ses04F_script01,278.1,285.8733,Session4,fru,69
Ses04F_script01_1_F034,What the hell is this?,xxx,-1,Ses04F_script01,286.3292,287.98,Session4,xxx,70
Ses04F_script01_1_M036,"I'll get out.  I'll get married and live someplace else, maybe New York.",xxx,-1,Ses04F_script01,287.61,291.31,Session4,xxx,71
Ses04F_script01_1_F035,Are you crazy?,angry,0,Ses04F_script01,290.77,293.319,Session4,ang,72
Ses04F_script01_1_M037,I've been a good son too long.  A good sucker I'm through with it.,xxx,-1,Ses04F_script01,292.63,296.89,Session4,xxx,73
Ses04F_script01_1_F036,You've got a business here.  What the hell is this?,angry,0,Ses04F_script01,296.46,299.89,Session4,ang,74
Ses04F_script01_1_M038,"The business, the business doesn't inspire me.",angry,0,Ses04F_script01,298.91,301.54,Session4,ang,75
Ses04F_script01_1_F037,Must you be inspired?,angry,0,Ses04F_script01,300.77,303.21,Session4,ang,76
Ses04F_script01_1_M039,"Yes, I like it an hour a day.  If I have to grub for money all day long, at least at evening I want it beautiful.",fru,-1,Ses04F_script01,302.19,308.86,Session4,fru,77
Ses04F_script01_1_M040,I want- I want a family.  I want some kids.  I want to build something I give myself to.  Annie is in the middle of that.  Now where do I find it?,fru,-1,Ses04F_script01,308.89,319.3535,Session4,fru,78
Ses04F_script01_1_F038,You mean-tell me something you mean you'd really leave the business?,fru,-1,Ses04F_script01,318.5431,324.84,Session4,fru,79
Ses04F_script01_1_M041,Yes on this I would.,xxx,-1,Ses04F_script01,324.42,327.65,Session4,xxx,80
Ses04F_script01_1_F039,Well you don't want to think that way.,xxx,-1,Ses04F_script01,327.2044,330.8006,Session4,xxx,81
Ses04F_script01_1_M042,Then you help me stay here.,fru,-1,Ses04F_script01,330.1928,333.84,Session4,fru,82
Ses04F_script01_1_F040,Alright but don't think that way,angry,0,Ses04F_script01,334.11,338.52,Session4,ang,83
Ses04F_script01_1_F041,"because what the hell did we work for?  This whole shooting match is just for you, Chris.",angry,0,Ses04F_script01,338.62,343.99,Session4,ang,84
Ses04F_script01_1_M043,I know.  Just you help me stay here.,fru,-1,Ses04F_script01,343.4633,347.1102,Session4,fru,85
Ses04F_script01_1_F042,But don't think that way.  You hear me?,angry,0,Ses04F_script01,346.2998,350.0,Session4,ang,86
Ses04F_script01_1_M044,I am thinking that way.,xxx,-1,Ses04F_script01,349.2,351.5675,Session4,xxx,87
Ses04F_script01_1_F043,I don't understand you do I?,xxx,-1,Ses04F_script01,352.08,355.113,Session4,xxx,88
Ses04F_script01_1_M045,No.  I'm a pretty tough guy.,xxx,-1,Ses04F_script01,354.7078,358.2534,Session4,xxx,89
Ses04F_script01_1_F044,Yeah.  I can see that.,angry,0,Ses04F_script01,357.7975,361.37,Session4,ang,90
Ses04F_script01_3_F000,You're the only one I know who loves his parents.,xxx,-1,Ses04F_script01,4.34,7.78,Session4,xxx,91
Ses04F_script01_3_M000,I know it went out of style didn't it?,xxx,-1,Ses04F_script01,7.3178,10.17,Session4,xxx,92
Ses04F_script01_3_F001,It's okay.  It's a good thing.,xxx,-1,Ses04F_script01,9.76,12.65,Session4,xxx,93
Ses04F_script01_3_F002,You know it's lovely here.  The air is sweet.,xxx,-1,Ses04F_script01,12.84,17.72,Session4,xxx,94
Ses04F_script01_3_M001,You're not sorry you came.,xxx,-1,Ses04F_script01,17.41,19.96,Session4,xxx,95
Ses04F_script01_3_F003,"Not sorry, no but I'm not staying.",xxx,-1,Ses04F_script01,19.35,24.88,Session4,xxx,96
Ses04F_script01_3_M002,Why?,xxx,-1,Ses04F_script01,24.39,25.96,Session4,xxx,97
Ses04F_script01_3_F004,"In the first place, your mother as much as told me to go.",xxx,-1,Ses04F_script01,25.4981,29.28,Session4,xxx,98
Ses04F_script01_3_M003,Well.,xxx,-1,Ses04F_script01,28.8,30.06,Session4,xxx,99
Ses04F_script01_3_F005,You saw that and you- you've been kind of-,xxx,-1,Ses04F_script01,29.66,33.2,Session4,xxx,100
Ses04F_script01_3_M004,What?,angry,0,Ses04F_script01,32.72,33.89,Session4,ang,101
Ses04F_script01_3_F006,Well kind of embarrassed ever since I got here.,xxx,-1,Ses04F_script01,33.36,37.83,Session4,xxx,102
Ses04F_script01_3_M005,The trouble is I planned on sneaking up on you over a period of a week or so but they take it for granted that we're all set.,xxx,-1,Ses04F_script01,37.3604,44.8877,Session4,xxx,103
Ses04F_script01_3_F007,"I knew they would, your mother anyway.",xxx,-1,Ses04F_script01,44.32,47.89,Session4,xxx,104
Ses04F_script01_3_M006,How did you know?,xxx,-1,Ses04F_script01,47.29,49.0651,Session4,xxx,105
Ses04F_script01_3_F008,From her point of view why else would I come?,xxx,-1,Ses04F_script01,48.54,52.07,Session4,xxx,106
Ses04F_script01_3_M007,Wouldn't you want to?,xxx,-1,Ses04F_script01,51.62,54.6613,Session4,xxx,107
Ses04F_script01_3_M008,I guess you know this is why I asked you to come.,neutral,3,Ses04F_script01,55.0554,59.75,Session4,neu,108
Ses04F_script01_3_F009,I guess this is why I came.,happy,1,Ses04F_script01,59.67,62.6615,Session4,hap,109
Ses04F_script01_3_M009,"Ann, I love you.  I love you a great deal.  I love you.",happy,1,Ses04F_script01,62.25,70.7011,Session4,hap,110
Ses04F_script01_3_M010,I have no imagination that's all I know to tell you.,happy,1,Ses04F_script01,71.62,79.3318,Session4,hap,111
Ses04F_script01_3_M011,I'm embarrassing you.  I didn't want to tell it to you here.  I,happy,1,Ses04F_script01,79.5288,84.3762,Session4,hap,112
Ses04F_script01_3_M012,"wanted some place we'd never been, a place where we'd be brand new to each other.",xxx,-1,Ses04F_script01,84.4157,90.9,Session4,xxx,113
Ses04F_script01_3_M013,"You think this is wrong, this chair, this yard.  I want you to be ready for me.  I don't want to win you away from anything.",xxx,-1,Ses04F_script01,90.93,100.35,Session4,xxx,114
Ses04F_script01_3_F010,"Chris, I've been ready a long, long time.",happy,1,Ses04F_script01,99.83,103.94,Session4,hap,115
Ses04F_script01_3_M014,And he's gone forever.  You're sure?,neutral,3,Ses04F_script01,103.8052,107.0763,Session4,neu,116
Ses04F_script01_3_F011,I almost got married two years ago.,xxx,-1,Ses04F_script01,106.4457,109.8743,Session4,xxx,117
Ses04F_script01_3_M015,Why didn't you?,xxx,-1,Ses04F_script01,109.33,111.37,Session4,xxx,118
Ses04F_script01_3_F012,You started to write me.,happy,1,Ses04F_script01,110.8202,113.47,Session4,hap,119
Ses04F_script01_3_M016,You felt something that far back?,xxx,-1,Ses04F_script01,112.98,115.28,Session4,xxx,120
Ses04F_script01_3_F013,Every day since.,happy,1,Ses04F_script01,114.71,117.27,Session4,hap,121
Ses04F_script01_3_M017,"Ann, why didn't you let me know?",xxx,-1,Ses04F_script01,117.0863,120.64,Session4,xxx,122
Ses04F_script01_3_F014,"I was waiting for you, Chris.  Till then you never wrote and then when you did what did you say.  I mean you sure can be ambiguous you know.",happy,1,Ses04F_script01,119.98,128.594,Session4,hap,123
Ses04F_script01_3_M018,"Give me a kiss, Ann.  Give me a-God I kissed you.",happy,1,Ses04F_script01,127.99,133.15,Session4,hap,124
Ses04F_script01_3_M019,"I kissed Annie.  How long, how long I've been waiting to kiss you.",happy,1,Ses04F_script01,133.21,138.7617,Session4,hap,125
Ses04F_script01_3_F015,I'll never forgive you.  Why did you wait all these years?  All I've done is sit and wonder if I was crazy for thinking of you.,happy,1,Ses04F_script01,138.33,145.84,Session4,hap,126
Ses04F_script01_3_M020,"Annie, we're going to live now.  I'm going to make you so happy.",happy,1,Ses04F_script01,145.23,149.0082,Session4,hap,127
Ses04F_script01_3_F016,Not like that you're not.,xxx,-1,Ses04F_script01,148.1018,151.0969,Session4,xxx,128
Ses04F_script01_3_M021,I kissed you.,xxx,-1,Ses04F_script01,150.6,152.56,Session4,xxx,129
Ses04F_script01_3_F017,"Like Larry's brother.  Do it like you, Chris.",xxx,-1,Ses04F_script01,151.87,157.3237,Session4,xxx,130
Ses04F_script01_3_F018,What is it Chris?,xxx,-1,Ses04F_script01,157.4813,160.8311,Session4,xxx,131
Ses04F_script01_3_M022,Let's drive some place.  I want to be alone with you.,xxx,-1,Ses04F_script01,159.7671,163.3,Session4,xxx,132
Ses04F_script01_3_F019,"No.  What is it Chris, your mother?",xxx,-1,Ses04F_script01,162.61,166.2303,Session4,xxx,133
Ses04F_script01_3_M023,"No, nothing like that.",sad,2,Ses04F_script01,165.8756,169.2648,Session4,sad,134
Ses04F_script01_3_F020,Well then what's wrong?  Even in your letters there was something ashamed.,xxx,-1,Ses04F_script01,168.7525,173.6393,Session4,xxx,135
Ses04F_script01_3_M024,Yes.  I suppose I have been but it's going from me.,sad,2,Ses04F_script01,173.59,181.1666,Session4,sad,136
Ses04F_script01_3_F021,You've got to tell me.,xxx,-1,Ses04F_script01,180.4572,183.64,Session4,xxx,137
Ses04F_script01_3_M025,I don't know where to start.,fru,-1,Ses04F_script01,183.0188,185.69,Session4,fru,138
Ses04F_script01_3_F022,It wouldn't work this way.,xxx,-1,Ses04F_script01,185.09,188.12,Session4,xxx,139
Ses04F_script01_3_M026,There's so many things mixed up.,sad,2,Ses04F_script01,188.31,193.6989,Session4,sad,140
Ses04F_script01_3_M027,You remember overseas I was in command of a company?,sad,2,Ses04F_script01,193.7383,197.39,Session4,sad,141
Ses04F_script01_3_F023,"Yeah, sure.",neutral,3,Ses04F_script01,196.82,199.2162,Session4,neu,142
Ses04F_script01_3_M028,Well I lost them.,sad,2,Ses04F_script01,198.4674,202.13,Session4,sad,143
Ses04F_script01_3_F024,How many?,sad,2,Ses04F_script01,201.5808,203.7483,Session4,sad,144
Ses04F_script01_3_M029,Just about all.,sad,2,Ses04F_script01,203.19,205.54,Session4,sad,145
Ses04F_script01_3_F025,"Oh, gees.",xxx,-1,Ses04F_script01,205.4,207.4923,Session4,xxx,146
Ses04F_script01_3_M030,It takes a lot of time to toss that off because they weren't just men.,sad,2,Ses04F_script01,207.2558,214.7042,Session4,sad,147
Ses04F_script01_3_M031,"For instance, one time it had been raining several days and this kid came to me and gave me his last pair of dry socks.",sad,2,Ses04F_script01,214.7831,224.9508,Session4,sad,148
Ses04F_script01_3_M032,I put them in my pocket. that's only a little thing but these are the kind of guys I had.,sad,2,Ses04F_script01,225.069,233.59,Session4,sad,149
Ses04F_script01_3_M033,They didn't die.  They killed themselves for each other.  I mean that exactly.  A little more selfish and they'd have been here today.,sad,2,Ses04F_script01,236.33,244.9709,Session4,sad,150
Ses04F_script01_3_M034,"And I got this idea watching them go down.  Everything was being destroyed see, but it seemed to me that there was one new thing that was made",sad,2,Ses04F_script01,245.33,255.15,Session4,sad,151
Ses04F_script01_3_M035,a sort of responsibility man for man.  You understand me?,sad,2,Ses04F_script01,255.22,260.8925,Session4,sad,152
Ses04F_script01_3_M036,And then I came home and it was amazing.,sad,2,Ses04F_script01,261.0501,265.2,Session4,sad,153
Ses04F_script01_3_M037,There was no meaning in it here.,xxx,-1,Ses04F_script01,265.71,270.07,Session4,xxx,154
Ses04F_script01_3_M038,The whole thing to them was sort of a bus accident. Then I went to work with father and that whole rat race again.,xxx,-1,Ses04F_script01,270.3902,277.9569,Session4,xxx,155
Ses04F_script01_3_M039,"I felt, what you said, ashamed somehow",sad,2,Ses04F_script01,277.9963,282.38,Session4,sad,156
Ses04F_script01_3_M040,because nobody was changed at all.  It seemed to make suckers out of a lot of guys.,sad,2,Ses04F_script01,282.7649,291.1985,Session4,sad,157
Ses04F_script01_3_M041,"I felt wrong to be alive, to open the new bank book, to drive the new car, to see the new refrigerator.",sad,2,Ses04F_script01,291.238,299.0411,Session4,sad,158
Ses04F_script01_3_M042,I mean you can take those things out of war but,xxx,-1,Ses04F_script01,299.1199,302.588,Session4,xxx,159
Ses04F_script01_3_M043,"when you drive the new car, you have to know that it came out of the love a man can have for a man.  You've got to be a little better because of that.",sad,2,Ses04F_script01,302.6274,311.8492,Session4,sad,160
Ses04F_script01_3_M044,Otherwise what you have is really just loot and there's blood on it.  I didn't want to take any of it.,sad,2,Ses04F_script01,311.8887,319.15,Session4,sad,161
Ses04F_script01_3_M045,I guess that included you.,sad,2,Ses04F_script01,319.6,323.1204,Session4,sad,162
Ses04F_script01_3_F026,And do you still feel that way?,xxx,-1,Ses04F_script01,321.9775,324.83,Session4,xxx,163
Ses04F_script01_3_M046,"I want you now, Annie.",xxx,-1,Ses04F_script01,324.52,326.5885,Session4,xxx,164
Ses04F_script01_3_F027,"Because you mustn't feel that way anymore because you have a right to whatever you have, Chris, do you understand, everything",xxx,-1,Ses04F_script01,326.0,333.54,Session4,xxx,165
Ses04F_script01_3_F028,that includes me.  And your money there's nothing wrong in your money.  Your father put hundreds of planes in the air.,xxx,-1,Ses04F_script01,333.61,340.7009,Session4,xxx,166
Ses04F_script01_3_F029,You should be proud.  A man should be paid for that.,xxx,-1,Ses04F_script01,340.72,343.9288,Session4,xxx,167
Ses04F_script01_3_M047,"Annie, Annie I'm going to make a fortune for you.",happy,1,Ses04F_script01,343.6529,347.7909,Session4,hap,168
Ses04F_script01_3_F030,What'll I do with a fortune?,happy,1,Ses04F_script01,347.39,350.28,Session4,hap,169
Ses04F_script01_2_F000,Why did he invite her?,angry,0,Ses04F_script01,7.3127,9.8942,Session4,ang,170
Ses04F_script01_2_M000,Why does that bother you?,neutral,3,Ses04F_script01,9.49,11.5305,Session4,neu,171
Ses04F_script01_2_F001,It's been three years.  Why all of a sudden?,angry,0,Ses04F_script01,10.92,13.962,Session4,ang,172
Ses04F_script01_2_M001,Well maybe- maybe he just wanted to see her again.,neutral,3,Ses04F_script01,13.69,17.56,Session4,neu,173
Ses04F_script01_2_F002,Nobody comes seven hundred miles just to see.,fru,-1,Ses04F_script01,16.94,20.93,Session4,fru,174
Ses04F_script01_2_M002,What do you mean?  He was brought up next door to the girl his whole life.  Why shouldn't he want to see her again?,xxx,-1,Ses04F_script01,20.4,27.037,Session4,xxx,175
Ses04F_script01_2_M003,Don't look at me like that.  He didn't tell me anymore than he told you.,xxx,-1,Ses04F_script01,27.26,31.88,Session4,xxx,176
Ses04F_script01_2_F003,She's not going to marry him.,xxx,-1,Ses04F_script01,31.0,34.22,Session4,xxx,177
Ses04F_script01_2_M004,How do you know he's even thinking about it?,neutral,3,Ses04F_script01,33.51,36.29,Session4,neu,178
Ses04F_script01_2_F004,It's got that about it.,xxx,-1,Ses04F_script01,35.63,38.7204,Session4,xxx,179
Ses04F_script01_2_M005,Well so what.,xxx,-1,Ses04F_script01,38.1087,41.7177,Session4,xxx,180
Ses04F_script01_2_F005,"What's going on here, Joe?",angry,0,Ses04F_script01,40.5402,43.71,Session4,ang,181
Ses04F_script01_2_M006,Listen kid.,fru,-1,Ses04F_script01,43.36,45.32,Session4,fru,182
Ses04F_script01_2_F006,"No, line.",angry,0,Ses04F_script01,45.2,48.39,Session4,ang,183
Ses04F_script01_2_M007,"Uh, Then why is she still-she's not his girl, Joe",neutral,3,Ses04F_script01,47.6359,57.5912,Session4,neu,184
Ses04F_script01_2_F007,"She's not his girl, Joe.  She knows she's not.",angry,0,Ses04F_script01,56.95,60.66,Session4,ang,185
Ses04F_script01_2_M008,You can't read her mind.,neutral,3,Ses04F_script01,59.85,62.19,Session4,neu,186
Ses04F_script01_2_F008,Then why is she still single?  New York is full of men.  Why hasn't she married?,angry,0,Ses04F_script01,61.5,66.782,Session4,ang,187
Ses04F_script01_2_F009,Probably a hundred people told her she's foolish but she's waited.,angry,0,Ses04F_script01,66.7973,71.45,Session4,ang,188
Ses04F_script01_2_M009,How do you know why she waited?,fru,-1,Ses04F_script01,71.01,72.56,Session4,fru,189
Ses04F_script01_2_F010,Because she knows what I know that's why.  She's faithful as a rock.,angry,0,Ses04F_script01,72.13,77.7008,Session4,ang,190
Ses04F_script01_2_F011,"In my worst moments, I think of her waiting and I know again that I'm right.",fru,-1,Ses04F_script01,77.7161,82.9155,Session4,fru,191
Ses04F_script01_2_M010,Look it's a nice day.  What are we arguing for?,fru,-1,Ses04F_script01,82.42,85.88,Session4,fru,192
Ses04F_script01_2_F012,"Nobody in this house dares take her faith away, Joe.  Strangers might but not his father, not his brother.",fru,-1,Ses04F_script01,85.43,92.96,Session4,fru,193
Ses04F_script01_2_M011,What do you want me to do?,fru,-1,Ses04F_script01,92.23,93.9,Session4,fru,194
Ses04F_script01_2_F013,"I want you to act like he's coming back, both of you.  Don't think I haven't noticed you since he invited her.  I won't stand for any nonsense.",xxx,-1,Ses04F_script01,93.46,101.72,Session4,xxx,195
Ses04F_script01_2_M012,But Kate-,fru,-1,Ses04F_script01,101.4,103.1779,Session4,fru,196
Ses04F_script01_2_F014,"Because if he's not coming back, I'll kill myself.",fru,-1,Ses04F_script01,102.5357,105.85,Session4,fru,197
Ses04F_script01_2_F015,"Laugh, laugh at me, but why did that happen the very night she came back?",xxx,-1,Ses04F_script01,106.0376,111.82,Session4,xxx,198
Ses04F_script01_2_F016,"She goes to sleep in his room and his memorial breaks in pieces.  Look, look at it.  Joe-",angry,0,Ses04F_script01,111.8487,120.61,Session4,ang,199
