id,utterance,label,label_num,file_id,start,end,session,original_emotion,utterance_num
Ses03M_impro04_M005,I applied as restaurant manager at P.F. Chang.  I applied at----Macy's store manager. Tried to get investment banking job with Deloitte and Touche.  I'm trying everywhere.,fru,-1,Ses03M_impro04_,43.23,57.03,Session3,fru,11
Ses03M_impro04_F006,"Yeah.  Well it seems to me, you know, you just got to keep going out there, you know, pushing through.  You got a Harvard degree.  I mean, you can get a job anywhere.",xxx,-1,Ses03M_impro04_,57.02,67.59,Session3,xxx,13
Ses03M_impro04_M006,You know what?  I've been working at temp jobs for the past six months.  You know how degrading it is?,fru,-1,Ses03M_impro04_,65.95,74.62,Session3,fru,14
Ses03M_impro04_F007,Yeah.,sad,2,Ses03M_impro04_,74.06,75.65,Session3,sad,15
Ses03M_impro04_M007,To be a receptionist?  Oh I spent forty thousand dollar a year for my college degree and I'm a receptionist.  God.,xxx,-1,Ses03M_impro04_,75.68,82.07,Session3,xxx,16
Ses03M_impro04_F008,Yeah.,sad,2,Ses03M_impro04_,81.54,82.79,Session3,sad,17
Ses03M_impro04_M008,I'm smarter than half the people I work for.,angry,0,Ses03M_impro04_,82.11,85.05,Session3,ang,18
Ses03M_impro04_F009,"Well, what do you...what would ideally like to do, you know?",xxx,-1,Ses03M_impro04_,84.55,88.4,Session3,xxx,19
Ses03M_impro04_M009,I don't know astronaut?  I don't know something crazy like that.,fru,-1,Ses03M_impro04_,88.36,92.14,Session3,fru,20
Ses03M_impro04_F010,Well what'd you major in?,happy,1,Ses03M_impro04_,91.26,93.45,Session3,exc,21
Ses03M_impro04_M010,Biomedical Engineering.,fru,-1,Ses03M_impro04_,93.68,96.41,Session3,fru,22
Ses03M_impro04_F011,"You-You can't be working as a restaurant manager, I mean, come on.",xxx,-1,Ses03M_impro04_,96.33,100.22,Session3,xxx,23
Ses03M_impro04_M011,"I don't want to do engineering though.  It's so...I had the internship what, last summer,",fru,-1,Ses03M_impro04_,99.3,105.34,Session3,fru,24
Ses03M_impro04_M012,"and I was pulling my hair out and it was like, oh my God.  So I just had to finish the major so now they're like, why are you an engineering major, and why are you working, trying to work at a restaurant.  And it's like I don't know just give me the damn job.",fru,-1,Ses03M_impro04_,105.3575,116.29,Session3,fru,25
Ses03M_impro04_F012,Look I'm sorry-,xxx,-1,Ses03M_impro04_,117.79,119.75,Session3,xxx,26
Ses03M_impro04_M013,Why all these questions?,fru,-1,Ses03M_impro04_,117.77,119.99,Session3,fru,27
Ses03M_impro04_F013,"You know if you need any help finding a place I can, I can talk to my work you know I work at that law firm downtown and I can ask if they're looking for anybody.",xxx,-1,Ses03M_impro04_,120.04,128.49,Session3,xxx,28
Ses03M_impro04_M014,Oh yeah?  What kind of jobs they got?,neutral,3,Ses03M_impro04_,127.57,129.49,Session3,neu,29
Ses03M_impro04_F014,I am...just like a law clerk.,neutral,3,Ses03M_impro04_,129.02,131.8,Session3,neu,30
Ses03M_impro04_M015,I don't want to be a law clerk.,dis,-1,Ses03M_impro04_,131.91,134.0,Session3,dis,31
Ses03M_impro04_F015,"Well, I'm moving up.  I mean it could be...",neutral,3,Ses03M_impro04_,133.6,136.9575,Session3,neu,33
Ses03M_impro04_M016,"To be a lawyer?  You go to law school now?  God this is, all these dead ends.",fru,-1,Ses03M_impro04_,136.6475,142.73,Session3,fru,34
Ses03M_impro04_M017,And plus my car is breaking down-,fru,-1,Ses03M_impro04_,142.765,146.03,Session3,fru,35
Ses03M_impro04_M018,-they're evicting me from my apartment.,fru,-1,Ses03M_impro04_,146.0525,148.7425,Session3,fru,36
Ses03M_impro04_F016,"Well it doesn't make any sense though.  Like, with a Harvard degree you should be able to--",xxx,-1,Ses03M_impro04_,148.4,153.24,Session3,xxx,37
Ses03M_impro04_M019,Yeah.  I know.  You'd think I would be able to be C.E.O. of a company right?,xxx,-1,Ses03M_impro04_,152.74,157.48,Session3,xxx,38
Ses03M_impro04_F017,"Just, you got to hang in there.  Can you ask your parents for help or anybody?",xxx,-1,Ses03M_impro04_,157.61,162.27,Session3,xxx,39
Ses03M_impro04_M020,"No.  I'm not going to...yeah, they'd laugh in my face.",fru,-1,Ses03M_impro04_,161.38,165.07,Session3,fru,40
Ses03M_impro04_F018,"Just for a little bit, you know?  Cause I-I guarantee you're going to find something.  When you find something it's just going to be huge and you're going to get money.",xxx,-1,Ses03M_impro04_,165.03,172.13,Session3,xxx,41
Ses03M_impro04_M021,No. I got a sixteen hundred on my S.A.T..,fru,-1,Ses03M_impro04_,170.6,174.52,Session3,fru,42
Ses03M_impro04_F019,Something-- How are you going...?,xxx,-1,Ses03M_impro04_,177.71,180.52,Session3,xxx,43
Ses03M_impro04_M022,I'm freaking----typing sixty words a minute.,fru,-1,Ses03M_impro04_,177.74,181.84,Session3,fru,44
Ses03M_impro04_F020,How many words a minute?,xxx,-1,Ses03M_impro04_,181.49,183.61,Session3,xxx,45
Ses03M_impro04_M023,"Sixty words.  Sixty words a minute.  Hey how are you doing Mr. Smith?  Oh, you know, it's just like God, I just want to shoot you Mr. Smith.",fru,-1,Ses03M_impro04_,183.12,190.55,Session3,fru,46
Ses03M_impro04_F021,Sixty words a minute.  That's a min...a word per min uh second.,xxx,-1,Ses03M_impro04_,190.14,193.74,Session3,xxx,47
Ses03M_impro04_M024,Yeah.  It's alright.  But--,neutral,3,Ses03M_impro04_,193.52,196.48,Session3,neu,48
Ses03M_impro04_F022,You could be an amazing receptionist.,xxx,-1,Ses03M_impro04_,196.57,199.9075,Session3,xxx,49
Ses03M_impro04_M025,I'm not cut to be a receptionist.,fru,-1,Ses03M_impro04_,196.66,198.77,Session3,fru,50
Ses03M_impro04_M026,No.,sad,2,Ses03M_impro04_,199.75,201.27,Session3,sad,51
Ses03M_impro04_M027,"Oh yeah.  I will be a full time receptionist.  Harvard degree, sixteen hundred on my S.A.T.--",fru,-1,Ses03M_impro04_,201.52,205.9,Session3,fru,52
Ses03M_impro04_F023,"Well... If you need something, I mean, you're just going to---can get a temporary thing right now and then look for something--",neutral,3,Ses03M_impro04_,205.59,212.11,Session3,neu,53
Ses03M_impro04_M028,--you know? Head of the Science Club.,fru,-1,Ses03M_impro04_,206.4975,209.77,Session3,fru,54
Ses03M_impro04_M029,"That's what I've been doing, temporary things",fru,-1,Ses03M_impro04_,211.24,214.08,Session3,fru,55
Ses03M_impro04_F024,Oh I know.  But--,fru,-1,Ses03M_impro04_,212.55,215.03,Session3,fru,56
Ses03M_impro04_F025,"-it's going to get better I promise you. You just got to hang in there. Everyone, I mean, you know?",neutral,3,Ses03M_impro04_,215.34,221.3,Session3,neu,57
Ses03M_impro04_M030,Maybe I'll just kill myself.,sad,2,Ses03M_impro04_,220.38,221.9175,Session3,sad,59
Ses03M_impro04_F026,What?  You can't...what?  Now come on.  Stop it.  Don't be talking like that.,sur,-1,Ses03M_impro04_,221.54,227.5,Session3,sur,60
Ses03M_impro04_M031,I was just joking...,sad,2,Ses03M_impro04_,225.4,227.06,Session3,sad,61
Ses03M_impro04_M032,I don't know.,xxx,-1,Ses03M_impro04_,227.68,230.37,Session3,xxx,62
Ses03M_impro04_F027,"My, what I would do was just, you know, what about can you call Harvard and see...don't they have connections?  Don't they have like career center and you can find some stuff that's going on?",xxx,-1,Ses03M_impro04_,231.26,241.94,Session3,xxx,63
Ses03M_impro04_M033,Yeah.  I--they said Brian you're too smart.  You don't need us.,fru,-1,Ses03M_impro04_,241.62,246.48,Session3,fru,64
Ses03M_impro04_M034,Go out and take over the world by yourself and I'm like what?,fru,-1,Ses03M_impro04_,246.505,249.7,Session3,fru,65
Ses03M_impro04_F028,Well obviously it's not working.  Just cause you got sixteen hundred on your S.A.T. doesn't guarantee you a job.  I mean it should really but--,fru,-1,Ses03M_impro04_,248.83,256.3,Session3,fru,66
Ses03M_impro04_M035,"I don't know.  I don't know.  I know I'm just going to have to keep on looking, keep on searching-",fru,-1,Ses03M_impro04_,255.77,262.57,Session3,fru,67
Ses03M_impro04_M036,"and I'm never going to find anything probably but I'll just keep working hard at it-- Yeah. Okay.  Positive, I'm going to do good, find that job.",fru,-1,Ses03M_impro04_,263.3,271.57,Session3,fru,68
Ses03M_impro04_F029,You got to be positive man.  You got to try to just--,neutral,3,Ses03M_impro04_,265.84,268.88,Session3,neu,69
Ses03M_impro04_F030,But you got to be real about it.  You have to...,neutral,3,Ses03M_impro04_,270.73,273.81,Session3,neu,70
Ses03M_impro04_M037,Yeah.  I got eighteen hundred on my S.A.T..,fru,-1,Ses03M_impro04_,274.6,277.78,Session3,fru,71
Ses03M_impro04_F031,Sixteen hundred.,neutral,3,Ses03M_impro04_,277.5,279.99,Session3,neu,72
Ses03M_impro04_M038,Same difference.,neutral,3,Ses03M_impro04_,279.88,282.21,Session3,neu,73
Ses03M_impro04_M039,Twenty-one hundred on my S.A.T..,xxx,-1,Ses03M_impro04_,282.84,285.58,Session3,xxx,74
Ses03M_impro04_F032,Twenty-one hundred?,neutral,3,Ses03M_impro04_,285.47,287.84,Session3,neu,75
Ses03M_impro04_M040,But I'm doomed.  Yeah I got so good I was over twenty one hundred.  Now what am I doing?,fru,-1,Ses03M_impro04_,287.81,292.9,Session3,fru,76
Ses03M_impro04_M041,"Like, wow you're really smart we're going to give you an extra [GARBAGE].",happy,1,Ses03M_impro04_,292.99,298.55,Session3,hap,77
Ses03M_impro05a_F000,Can I help you sir?,neutral,3,Ses03M_impro05a,5.73,7.53,Session3,neu,0
Ses03M_impro05a_M000,Yes you can help me.  Where is my luggage?,angry,0,Ses03M_impro05a,7.17,11.72,Session3,ang,1
Ses03M_impro05a_F001,"Well, let me just check on that for you.  Where are you coming--?",neutral,3,Ses03M_impro05a,11.22,14.59,Session3,neu,2
Ses03M_impro05a_M001,Yeah.  You do that.  I'm coming from Baltimore.  You know where that is?,angry,0,Ses03M_impro05a,13.83,17.78,Session3,ang,3
Ses03M_impro05a_F002,"Sir, yes it's in Maryland.  It's okay...well, I'm...just let me check here.",neutral,3,Ses03M_impro05a,17.32,22.2,Session3,neu,4
Ses03M_impro05a_M002,I had eight hundred pounds of luggage.,angry,0,Ses03M_impro05a,21.76,25.02,Session3,ang,5
Ses03M_impro05a_F003,Okay.  Sir?  Can you...if you just give me one moment and let me just check okay?,fru,-1,Ses03M_impro05a,24.09,27.76,Session3,fru,6
Ses03M_impro05a_M003,Okay.  Check.,angry,0,Ses03M_impro05a,26.95,28.6507,Session3,ang,7
Ses03M_impro05a_F004,"Alright.  And you're coming-- Wait, hold on sir.  You're coming from Baltimore into LAX right?",fru,-1,Ses03M_impro05a,28.11,33.9325,Session3,fru,8
Ses03M_impro05a_M004,Is it there?,angry,0,Ses03M_impro05a,29.44,30.5,Session3,ang,9
Ses03M_impro05a_M005,Yes.,angry,0,Ses03M_impro05a,33.53,34.59,Session3,ang,10
Ses03M_impro05a_F005,Okay and this is direct flight?,neutral,3,Ses03M_impro05a,34.16,35.85,Session3,neu,11
Ses03M_impro05a_M006,You don't know where we're at?,angry,0,Ses03M_impro05a,34.94,37.05,Session3,ang,12
Ses03M_impro05a_M007,God.,angry,0,Ses03M_impro05a,37.0975,38.98,Session3,ang,13
Ses03M_impro05a_F006,I'm asking you if this is direct flight from Baltimore to LAX or if you have to stop--,fru,-1,Ses03M_impro05a,38.175,42.27,Session3,fru,14
Ses03M_impro05a_M008,You know I've been waiting here for four hours for my luggage,xxx,-1,Ses03M_impro05a,41.19,45.365,Session3,xxx,15
Ses03M_impro05a_M009,"and it's not here, they told me to go to this person, go to this person.  Now I'm at this person.",xxx,-1,Ses03M_impro05a,45.4125,50.24,Session3,xxx,16
Ses03M_impro05a_F007,You're at me and I'm going to try to help you out sir but you just have to cooperate with me--,neutral,3,Ses03M_impro05a,49.4,53.89,Session3,neu,17
Ses03M_impro05a_M010,Okay.  What do you want?,angry,0,Ses03M_impro05a,53.11,55.07,Session3,ang,18
Ses03M_impro05a_F008,How many pieces of luggage do you have checked in?,neutral,3,Ses03M_impro05a,54.49,57.02,Session3,neu,19
Ses03M_impro05a_M011,Eight.  And they're all gone.,angry,0,Ses03M_impro05a,56.55,59.74,Session3,ang,20
Ses03M_impro05a_F009,Eight pieces of luggage.  Okay.,neutral,3,Ses03M_impro05a,59.01,61.82,Session3,neu,21
Ses03M_impro05a_M012,And what are you going to do about it?  You going to call someone?  You going to send me somewhere else?,angry,0,Ses03M_impro05a,60.95,66.43,Session3,ang,22
Ses03M_impro05a_F010,No.  I'm just going to check--,fru,-1,Ses03M_impro05a,65.77,67.72,Session3,fru,23
Ses03M_impro05a_M013,It's my mother's funeral tomorrow and the urn is in the suitcase.,angry,0,Ses03M_impro05a,67.1,72.19,Session3,ang,24
Ses03M_impro05a_F011,I'm sorry sir.,neutral,3,Ses03M_impro05a,71.54,73.33,Session3,neu,25
Ses03M_impro05a_M014,Yeah.,angry,0,Ses03M_impro05a,72.64,74.1625,Session3,ang,26
Ses03M_impro05a_F012,I'm very sorry but let's check on this immediately.  This is definitely an emergency.  It seems--,neutral,3,Ses03M_impro05a,74.25,80.89,Session3,neu,27
Ses03M_impro05a_M015,What am I going to do tomorrow without the urn?,xxx,-1,Ses03M_impro05a,79.42,83.51,Session3,xxx,28
Ses03M_impro05a_F013,Sir it seems to me that your luggage is um- is not here,xxx,-1,Ses03M_impro05a,82.77,87.68,Session3,xxx,29
Ses03M_impro05a_M016,"Oh, oh, that's a good deduction.",angry,0,Ses03M_impro05a,87.19,91.3275,Session3,ang,30
Ses03M_impro05a_F014,Yes--it is,neutral,3,Ses03M_impro05a,90.9925,92.21,Session3,neu,31
Ses03M_impro05a_M017,"Sherlock Holmes.  God, where's my luggage?",angry,0,Ses03M_impro05a,91.36,94.47,Session3,ang,32
Ses03M_impro05a_F015,"Sir, Please please, I would ask you to just calm down for a second--",fru,-1,Ses03M_impro05a,93.18,96.71,Session3,fru,33
Ses03M_impro05a_M018,Calm down?  It's my mother's funeral tomorrow.  I'm the one responsible for this.,angry,0,Ses03M_impro05a,96.24,102.32,Session3,ang,34
Ses03M_impro05a_F016,"Okay.  We will find your luggage.  Apparently because it somehow...what flight you were taking, you were on Delta?",neutral,3,Ses03M_impro05a,101.69,107.76,Session3,neu,35
Ses03M_impro05a_M019,Yes.  You are a Delta representative.,xxx,-1,Ses03M_impro05a,107.2,111.21,Session3,xxx,36
Ses03M_impro05a_F017,"Yes, I am.",xxx,-1,Ses03M_impro05a,111.21,113.51,Session3,xxx,37
Ses03M_impro05a_M020,What is the matter with you?,angry,0,Ses03M_impro05a,113.59,116.3,Session3,ang,38
Ses03M_impro05a_F018,"Sir, I just...you need to calm down is what needs to happen right now.",angry,0,Ses03M_impro05a,115.88,119.74,Session3,ang,39
Ses03M_impro05a_M021,Don't yell at me.,angry,0,Ses03M_impro05a,119.01,120.88,Session3,ang,40
Ses03M_impro05a_F019,"Okay.  I'm not.  I'm sorry, I am being--",fru,-1,Ses03M_impro05a,120.34,122.94,Session3,fru,41
Ses03M_impro05a_F020,"calm.  Sir, okay basically what- what's going to happen here is you're going to give me your contact information and we will contact you--",fru,-1,Ses03M_impro05a,122.98,129.55,Session3,fru,42
Ses03M_impro05a_M022,Oh my God.  I think a blood vessel burst in my head.,angry,0,Ses03M_impro05a,126.79,130.58,Session3,ang,43
Ses03M_impro05a_F021,"Please, please",neutral,3,Ses03M_impro05a,130.13,131.39,Session3,neu,44
Ses03M_impro05a_F022,"sir, listen to me.  Your luggage is still in Baltimore.",xxx,-1,Ses03M_impro05a,131.41,134.295,Session3,xxx,45
Ses03M_impro05a_M023,What?,angry,0,Ses03M_impro05a,133.9,135.21,Session3,ang,46
Ses03M_impro05a_F023,Okay.  We can get it here in about seven to ten business days.,neutral,3,Ses03M_impro05a,134.62,139.06,Session3,neu,47
Ses03M_impro05a_M024,What?  Are you kidding me?,angry,0,Ses03M_impro05a,138.5675,140.99,Session3,ang,48
Ses03M_impro05a_F024,"Yes.  Well, because--",neutral,3,Ses03M_impro05a,140.49,141.87,Session3,neu,49
Ses03M_impro05a_M025,Give- Give me your manager right now.,angry,0,Ses03M_impro05a,141.2,143.71,Session3,ang,50
Ses03M_impro05a_F025,I am the manager sir.,neutral,3,Ses03M_impro05a,143.29,145.77,Session3,neu,51
Ses03M_impro05a_M026,"You're the manager? You don't know where you work for, you don't know where you're at and you're the manager?",angry,0,Ses03M_impro05a,145.05,151.19,Session3,ang,52
Ses03M_impro05a_F026,Sir I know where I work for but I was checking because you cannot--,xxx,-1,Ses03M_impro05a,149.51,152.87,Session3,xxx,53
Ses03M_impro05a_M027,Whose daughter are you?,angry,0,Ses03M_impro05a,152.29,154.61,Session3,ang,54
Ses03M_impro05a_F027,Sir?,fru,-1,Ses03M_impro05a,153.89,155.71,Session3,fru,55
Ses03M_impro05a_M028,Sir. Sir. Sir. Sir,angry,0,Ses03M_impro05a,156.045,159.485,Session3,ang,56
Ses03M_impro05a_F028,What is your name?,angry,0,Ses03M_impro05a,156.69,157.98,Session3,ang,57
Ses03M_impro05a_M029,My name is Brent Caption.,angry,0,Ses03M_impro05a,160.05,162.53,Session3,ang,58
Ses03M_impro05a_M030,Now what are you going to do about it?,happy,1,Ses03M_impro05a,162.76,167.4425,Session3,exc,59
Ses03M_impro05b_F000,Can I help you sir?,neutral,3,Ses03M_impro05b,5.2466,7.93,Session3,neu,0
Ses03M_impro05b_M000,Yeah.,xxx,-1,Ses03M_impro05b,7.26,10.25,Session3,xxx,1
Ses03M_impro05b_M001,I've been here for four hours and I don't know where one piece of my luggage is,fru,-1,Ses03M_impro05b,10.59,16.91,Session3,fru,2
Ses03M_impro05b_F001,Okay.  Well let's...well I'm going to go ahead and check on that for you.  You're coming from...where are you coming from?,neutral,3,Ses03M_impro05b,15.935,20.6125,Session3,neu,3
Ses03M_impro05b_M002,Baltimore.,fru,-1,Ses03M_impro05b,20.28,21.72,Session3,fru,4
Ses03M_impro05b_F002,Baltimore and this is a direct flight to LAX,neutral,3,Ses03M_impro05b,20.94,23.45,Session3,neu,5
Ses03M_impro05b_M003,Yes.,fru,-1,Ses03M_impro05b,23.09,24.47,Session3,fru,6
Ses03M_impro05b_F003,Okay.  Let's look up here,neutral,3,Ses03M_impro05b,23.9,26.15,Session3,neu,7
Ses03M_impro05b_M004,You know and they've looked it up before and it's not there.,fru,-1,Ses03M_impro05b,25.85,29.35,Session3,fru,8
Ses03M_impro05b_F004,Okay.  Well you um-...,neutral,3,Ses03M_impro05b,28.91,30.67,Session3,neu,9
Ses03M_impro05b_M005,Now what are you going to do for me different? Hmm?,fru,-1,Ses03M_impro05b,30.09,33.0,Session3,fru,10
Ses03M_impro05b_F005,"What I can do for you is uh we can uh report lost, lost property.",neutral,3,Ses03M_impro05b,31.64,38.215,Session3,neu,11
Ses03M_impro05b_M006,You can report lost property?,fru,-1,Ses03M_impro05b,37.86,40.12,Session3,fru,12
Ses03M_impro05b_F006,Yes.,neutral,3,Ses03M_impro05b,39.73,40.77,Session3,neu,13
Ses03M_impro05b_M007,"Okay.  I'm leaving LA tomorrow for San Diego, driving there.  So, I'm going to leave without all my lost property?  That's what you want me to do? um",fru,-1,Ses03M_impro05b,40.31,51.47,Session3,fru,14
Ses03M_impro05b_F007,"Well sir, if if...what I believe has happened is most of the flight was left--",neutral,3,Ses03M_impro05b,50.09,55.89,Session3,neu,15
Ses03M_impro05b_F008,the luggage was left in Baltimore.  Therefore--,neutral,3,Ses03M_impro05b,55.91,58.635,Session3,neu,16
Ses03M_impro05b_M008,Most of the...,angry,0,Ses03M_impro05b,58.32,60.06,Session3,ang,17
Ses03M_impro05b_F009,"Like the luggage, the luggage on the flight.",neutral,3,Ses03M_impro05b,59.7475,62.15,Session3,neu,18
Ses03M_impro05b_M009,Wow.  This is an incompetent airline isn't it?  Are you--?,xxx,-1,Ses03M_impro05b,61.39,64.87,Session3,xxx,19
Ses03M_impro05b_F010,No actually it was...this is the first time this has ever happened.  I don't know what happened--,neutral,3,Ses03M_impro05b,64.06,68.16,Session3,neu,20
Ses03M_impro05b_M010,"Are you going to refund us for our luggage, refund us for our tickets for this?",fru,-1,Ses03M_impro05b,66.72,72.44,Session3,fru,21
Ses03M_impro05b_F011,"Well, we can give you um- hotel lodging for a night if that--",neutral,3,Ses03M_impro05b,71.09,77.81,Session3,neu,23
Ses03M_impro05b_M011,I'm going to San Diego tomorrow to stay with my family.  What do I need hotel lodging for hmmm?  Can you tell me that?,angry,0,Ses03M_impro05b,76.2,83.22,Session3,ang,24
Ses03M_impro05b_F012,For tonight- For tonight sir.  Would you need to stay somewhere tonight?,neutral,3,Ses03M_impro05b,81.52,85.5,Session3,neu,25
Ses03M_impro05b_M012,Tonight no.  I'm driving tomorrow.  Tonight I'm staying with a friend alright?  I don't need hotel reservations...where?  What hotel?,xxx,-1,Ses03M_impro05b,84.89,92.77,Session3,xxx,26
Ses03M_impro05b_F013,We can do Holiday Inn or...?,neutral,3,Ses03M_impro05b,92.37,96.17,Session3,neu,27
Ses03M_impro05b_M013,Wow.  Thank you.  Holiday Inn.  Wow.  Thank...the flight cost five hundred dollars.,angry,0,Ses03M_impro05b,95.22,102.04,Session3,ang,28
Ses03M_impro05b_F014,Sir I understand that but just--,neutral,3,Ses03M_impro05b,101.76,103.87,Session3,neu,29
Ses03M_impro05b_M014,"Okay, so you can put me in Holiday Inn for twenty dollar a night?",angry,0,Ses03M_impro05b,102.06,106.54,Session3,ang,30
Ses03M_impro05b_F015,Did you have your name tags on the luggage?,neutral,3,Ses03M_impro05b,105.74,108.77,Session3,neu,31
Ses03M_impro05b_M015,Of course I had my name tags on the luggage.,angry,0,Ses03M_impro05b,108.21,110.95,Session3,ang,32
Ses03M_impro05b_F016,"Okay.  So if you can just give me your name, your name and your address and your phone number I can contact you as soon as we find out more information.",neutral,3,Ses03M_impro05b,110.04,118.68,Session3,neu,33
Ses03M_impro05b_M016,Soon as you...that's not good enough okay?,angry,0,Ses03M_impro05b,117.08,120.8,Session3,ang,34
Ses03M_impro05b_F017,"Sir, please calm down.",fru,-1,Ses03M_impro05b,120.54,124.29,Session3,fru,35
Ses03M_impro05b_M017,I need you to help me out here.  Can you get on the phone and get the luggage over on the fastest flight you can and then maybe I won't get you fired.,fru,-1,Ses03M_impro05b,123.97,134.6925,Session3,fru,36
Ses03M_impro05b_M018,"If not, I'm going to get your name, I'm going to talk to your boss, whoever...I'm never going to fly...my business is never going to fly Delta again.",fru,-1,Ses03M_impro05b,134.72,142.87,Session3,fru,37
Ses03M_impro05b_F018,What is your business?,neutral,3,Ses03M_impro05b,142.47,144.38,Session3,neu,39
Ses03M_impro05b_M019,I work for IBM.,neutral,3,Ses03M_impro05b,144.25,146.215,Session3,neu,40
Ses03M_impro05b_F019,"Okay.  Sir?  I am sorry to tell you this but this does happen. Uh- This is not uh- really,",neutral,3,Ses03M_impro05b,145.8,153.13,Session3,neu,41
Ses03M_impro05b_F020,"I mean, our airline's fault.  I don't know what happened, misplaced, something happened but we will get you--",neutral,3,Ses03M_impro05b,153.145,159.61,Session3,neu,42
Ses03M_impro05b_M020,"You misplace a lot of, eight pieces of luggage.",angry,0,Ses03M_impro05b,157.97,161.94,Session3,ang,43
Ses03M_impro05b_F021,"Well, the entire flight, sir, the luggage was placed on another plane that never actually left Baltimore.",neutral,3,Ses03M_impro05b,161.48,168.58,Session3,neu,44
Ses03M_impro05b_F022,Uh no I'm not.,neutral,3,Ses03M_impro05b,168.58,170.04,Session3,neu,45
Ses03M_impro05b_M021,Are you kidding me?,angry,0,Ses03M_impro05b,167.08,168.81,Session3,ang,46
Ses03M_impro05b_M022,Who are you going to fire because of that?,angry,0,Ses03M_impro05b,169.02,171.5,Session3,ang,47
Ses03M_impro05b_F023,"Well we have some people back there that need some firing so, but I would just really appreciate--",neutral,3,Ses03M_impro05b,170.61,177.53,Session3,neu,48
Ses03M_impro05b_M023,"Wow.  This has never happened before.  I've not lost,",angry,0,Ses03M_impro05b,174.24,178.54,Session3,ang,49
Ses03M_impro05b_M024,in all thousand flights I've been on probably I can't even count how many flights I've been on.  This has never happened before.,angry,0,Ses03M_impro05b,178.54,183.5225,Session3,ang,50
Ses03M_impro05b_M025,This is the worst customer service I've ever gotten before.,angry,0,Ses03M_impro05b,183.54,186.45,Session3,ang,51
Ses03M_impro05b_F024,Okay sir.  I'm sorry you can--um-,fru,-1,Ses03M_impro05b,186.06,187.86,Session3,fru,53
Ses03M_impro05b_M026,Okay.  Get on the phone and figure out where my luggage is and tell me when it's going to get there alright?,angry,0,Ses03M_impro05b,187.43,192.33,Session3,ang,54
Ses03M_impro05b_F025,We already have been confirmed that it will be arriving in--uh--in about two days.,fru,-1,Ses03M_impro05b,191.17,196.95,Session3,fru,55
Ses03M_impro05b_M027,"And and, in about...",angry,0,Ses03M_impro05b,194.71,197.07,Session3,ang,56
Ses03M_impro05b_M028,Two days I'll be in San Diego and how's it going to get to me in San Diego?  You going to make sure it gets to the San Diego airport?,fru,-1,Ses03M_impro05b,197.23,203.47,Session3,fru,57
Ses03M_impro05b_F026,"Uh, we can't--",fru,-1,Ses03M_impro05b,202.95,205.0,Session3,fru,58
Ses03M_impro05b_M029,Can you get it to the San Diego airport?  You get someone to drive it to my place alright? Then I get a refund for some...I get a free flight alright? I get free whatever.,angry,0,Ses03M_impro05b,204.14,213.07,Session3,ang,59
Ses03M_impro05b_F027,"Yes sir, Yes.",neutral,3,Ses03M_impro05b,207.73,209.53,Session3,neu,60
Ses03M_impro05b_F028,We can have them direct your luggage to San Diego.,neutral,3,Ses03M_impro05b,212.48,215.76,Session3,neu,61
Ses03M_impro05b_M030,Okay.  And you're going to give me what for my inconvenience?,fru,-1,Ses03M_impro05b,215.17,219.15,Session3,fru,62
Ses03M_impro05b_F029,Uh--,neutral,3,Ses03M_impro05b,218.89,221.71,Session3,neu,63
Ses03M_impro05b_F030,Some refreshments in the lobby?,neutral,3,Ses03M_impro05b,221.8475,225.04,Session3,neu,64
Ses03M_impro05b_M031,Some peanuts?  Wow.  That helps a lot.,angry,0,Ses03M_impro05b,224.32,229.99,Session3,ang,65
Ses03M_impro05b_M032,"Thanks you, thank you I don't have my luggage so you gave me a Holiday Inn stay and peanuts.  Wow.  You know what?",angry,0,Ses03M_impro05b,230.07,238.22,Session3,ang,66
Ses03M_impro05b_F031,eh- we actually--,fru,-1,Ses03M_impro05b,233.07,235.31,Session3,fru,67
Ses03M_impro05b_M033,I will never do business with Delta again.,angry,0,Ses03M_impro05b,238.43,241.61,Session3,ang,68
Ses03M_impro06_F000,How's it going?  How are you feeling?,sad,2,Ses03M_impro06_,9.6133,14.6512,Session3,sad,0
Ses03M_impro06_M000,I ah--,sad,2,Ses03M_impro06_,13.5804,16.6469,Session3,sad,1
Ses03M_impro06_M001,alright.,sad,2,Ses03M_impro06_,17.2553,20.0055,Session3,sad,2
Ses03M_impro06_F001,Hanging in there?,sad,2,Ses03M_impro06_,19.2023,22.2932,Session3,sad,3
Ses03M_impro06_M002,Yeah.,sad,2,Ses03M_impro06_,21.3927,24.4349,Session3,sad,4
Ses03M_impro06_F002,So sad.,sad,2,Ses03M_impro06_,27.9882,31.5658,Session3,sad,5
